### ISSUE TITLE
IPv4 of resolved external DNS not used, need help debugging

### ISSUE THREAD

**Issue by andrejcremoznik** [kubernetes/minikube#12726]
I have a pod running an alpine based container that can't resolve IPv4 `A` records for external domains. To be less vague;

```
ping duckduckgo.com
ping: bad address 'duckduckgo.com'
```

But if I explicitly request IPv4 it works:

```
ping -4 duckduckgo.com
PING duckduckgo.com (40.114.177.156) 56(84) bytes of data.
```

This was run on the pod on a minikube on linux host with virtualbox driver. In `/etc/resolv.conf` there's the `kube-dns` nameserver:

```
nameserver 10.96.0.10
search default.svc.cluster.local svc.cluster.local cluster.local 
options ndots:5
```

If I try changing to `nameserver 1.1.1.1` on that pod (or any other public DNS service), it works fine, so I'm assuming something's wrong with `kube-dns`.

Inspecting `kube-dns` logs I can see that it responds with correct resolutions to dns queries:

```
[INFO] 172.17.0.1:43701 - 43765 "AAAA IN duckduckgo.com. udp 32 false 512" NXDOMAIN qr,rd,ra 32 0.000990408s
[INFO] 172.17.0.1:43701 - 43124 "A IN duckduckgo.com. udp 32 false 512" NOERROR qr,rd,ra 62 0.005836284s
```

AAAA failed but A got resolved. I looked at the data with `tcpdump` and the resolved domain's IPv4 was there as expected.

```
$ tcpdump -n host 10.96.0.10
09:29:29.666777 IP 172.17.0.5.47281 > 10.96.0.10.53: 43124+ A? duckduckgo.com. (32)
09:29:29.666847 IP 172.17.0.5.47281 > 10.96.0.10.53: 43765+ AAAA? duckduckgo.com. (32)
09:29:29.668264 IP 10.96.0.10.53 > 172.17.0.5.47281: 43765 NXDomain 0/0/0 (32)
09:29:29.673107 IP 10.96.0.10.53 > 172.17.0.5.47281: 43124 1/0/0 A 40.114.177.156 (62)
```

I lack the underlying understanding of networking and TCP to be able to resolve this. For some reason IPv4 resolutions are ignored by the system. Maybe they're delayed or there's some race condition where a failed IPv6 is attempted while IPv4 is ignored.

Also, consider me a Kubernetes noob, I might have just misconfigured something. Any help or pointers on what should I be looking for are greatly appreciated!
